url,title,content,category
http://index.hr/vijesti/clanak/prosvjednici-protiv-covidpotvrda-molili-krunicu-batarelo-odrzao-govor/2317054.aspx,prosvjednici-protiv-covidpotvrda-molili-krunicu-batarelo-odrzao-govor,"NA MARKOVOM trgu se održava novi prosvjed protiv covid-potvrda i cijepljenja. 
Prosvjednici su se počeli okupljati oko 17:30, a na trgu ih je bilo nekoliko stotina.

Protive se širem uvođenju covid-potvrda koje će 15. studenoga postati obavezne u javnim i državnim službama. U rukama drže lampione.
Prosvjed je nadgledala interventna policija, a na trgu su bila i djeca.
Prosvjednici su molili krunicu i hodali u koloni kojoj je na čelu bio čelnik ultrakatoličke udruge Vigilare Vice Batarelo.
Batarelo: Cijepljenje se nameće zdravim ljudima
Batarelo je održao govor.
""Prisilno cijepljenje se nameće zdravim ljudima koji se nemaju potrebu cijepiti. Vi koji ste tu, sve vas je više, pozovite ljude. Važno je da ispunimo ovaj dio do Lotrščaka"", rekao je.
""Ovdje smo jer tražimo svoja prava"", kaže.
""Važno je da smo zajedno kao narod, kako smo bili i 91."", rekao je. Okupljeni su pljeskali.
Kaže da će osigurati pravnu pomoć svima koji se ne žele cijepiti i testirati.
Govorio je i odvjetnik Mate Knezović, koji je poručio: ""Ne bojte se."" Pozvao je sve da pozovu ""susjede, žene, djecu na sutrašnji prosvjed"".
Štokinger: Statistika umrlih od covida - laž
Batarelo je najavio idućeg govornika, pravnika Tomislava Štokingera.
""Draga braćo i sestre, dragi sugrađani. Ja sam diplomirani pravnik, branitelj i autor knjige Vukovar - grad koji je obranio Hrvatsku. 21 godinu sam radio u Ministarstvu zdravstva i uvijek sam bio ocijenjen najboljom ocjenom"", rekao je.
""U petak sam dao otkaz. Nemam drugi posao i svjestan sam da sam ostao bez prihoda. Međutim, svih ovih godina sam služio u upravi moje države, za naše građane. Više nisam mogao služiti vlasti koja fašističkim metodama segregira vlastite građane"", rekao je Štokinger.
Kaže da zna neke stvari koje obični građani ne znaju.
""Međutim, reći ću samo tri riječi: laž, laž i laž! Pozitivni i negativni testovi - laž! Statistika umrlih od covida - laž! Da samo znate koliko je ljudi umrlo jer nije moglo dobiti usluge zbog ove histerije. Da znate koliko je ljudi završilo na psihijatriji zbog ove fašističke medijske harange"", rekao je. 
Okupljeni su počeli skandirati ""izdaja"".
""Ovo je najveći specijalni rat u povijesti čovječanstva""
""Kako volim svoju zemlju, još od 2000. godine bavim se proučavanjem specijalnog rata. Draga braćo i sestre, u tijeku je najveći specijalni rat u povijesti čovječanstva, protiv čovječanstva"", kaže.
Najjače oružje u tom ratu su mediji, rekao je.
""Mediji u svijetu, a pogotovo u Hrvatskoj, ispisuju najcrnje stranice svog postojanja. Nacistička propaganda je ništa u odnosu na medije, pogotovo u Hrvatskoj"", kaže.
""Kad to sve znamo, što nam je činiti? Treba se boriti, ali kako? Reći ću vam. Nema ništa od prosvjeda. Nasiljem se nikad ništa nije riješilo pa neće ni ovaj rat. Potrebno je da svi slobodni ljudi organiziraju alternativni svijet u kojem neće priznati vladajuće politike i mjere"", rekao je.
""Ova bitka se vodi u ime Isusa Krista i Blažene Djevice Marije. Ali ova bitka nije unaprijed odlučena. Isus od nas traži vjeru, odricanje i patnju. Pitam vas jeste li spremni krenuti u borbu?"" kaže. 
Okupljeni viču da jesu.
""Jeste li spremni na veliku patnju, da možda ostanete bez posla, da vas se odrekne obitelj, da ćete biti gladni i promrzli, da ćete možda iskusiti smrt?"" pita.
Okupljeni viču ""idemo"", ""da"" i ""za Isusa Krista"".
Za kraj je rekao da će naziv pokreta koji će uslijediti biti ""Nacija slobodnih"".
Govor je završio skandiranjem okupljenih, vikali su ""nacija slobodnih"", a Štokinger je rekao da će ih povesti u pobjedu.
Prosvjedovat će u još šest gradova
Prosvjede su najavljivali i iz Inicijative prava i slobode, iz koje su jutros objavili najavu današnjih prosvjeda u Zagrebu i još šest gradova.
U Zadru će se prosvjed održati u 20 sati, u Splitu u 21, u Šibeniku u 19, u Osijeku u 20, u Puli u 19 te u Vinkovcima u 20 sati.
Prosvjednici su jučer pred vladu i sabor došli sa svijećama u rukama, a sve je prije dva dana najavila ultrakatolička udruga Vigilare.
>> VIDEO Prosvjed pred saborom i vladom zbog covid-potvrda, stigla i policija",vijesti
http://index.hr/sport/clanak/rukometasi-u-subotu-igraju-protiv-slovenije-evo-sto-su-radili-na-pripremama/2316036.aspx,rukometasi-u-subotu-igraju-protiv-slovenije-evo-sto-su-radili-na-pripremama,"KRATKE jednotjedne pripreme hrvatske rukometne reprezentacije u Poreču stigle su gotovo do samog kraja, a u subotu reprezentaciju u Novigradu čeka prijateljski susret protiv Slovenije u 18 sati. 
""Jedna zahtjevna faza bliži se kraju i jako bitna faza za nas jer smo ušli u određene promjene. Velika je odgovornost na novim igračima, ali vjerujem da ćemo odgovoriti svim tim izazovima. Marin Šipić je malo osjetio rame, nije ništa ozbiljno, ali pozvali smo Grahovca da uskoči na njegovo mjesto"", kazao je izbornik Hrvoje Horvat. 
Prema najavama Slovenija bi trebala stići kompletna, bit će tu Blaž Janc, Domen Makuc, Miha Zarabec, Borut Mačkovšek, Gašper Marguč, Blaž Blagotinšek i druga velika imena iz najboljih svjetskih klubova poput Barcelone, Kiela, Veszprema i Pick Szegeda. Na posljednjem Europskom prvenstvu 2020. godine Slovenci su osvojili četvrto mjesto, a u Egiptu na Svjetskom prvenstvu ove godine bili su deveti.
Hrvatska neće biti kompletna u tom susretu. Neće biti Luke Cindrića, koji se još oporavlja od ozljede, a Fran Mileta se nedavno teško ozlijedio i za njega je ova sezona završena.
Zbog sve teže epidemiološke situacije broj gledatelja u dvorani u Novigradu je ograničen, ali će navijači hrvatsku reprezentaciju moći gledati u izravnom prijenosu na HTV-u 2.
""Dobro je bilo, izbornik nam je pokazao kako želi u budućnosti da izgleda reprezentacija, a mi smo to pokušali vježbati na terenu. Sutra na utakmici ćemo to i pokazati. Mislim da ne trebamo previše pričati o našim protivnicima, nego pričati o nama, o našoj igri. Pozivam sve navijače da dođu u dvoranu"", poručio je reprezentativac Hrvatske Domagoj Pavlović. ",sport
http://index.hr/vijesti/clanak/sin-osnivaca-hcspa-dobio-cetiri-godine-zatvora-za-pokusaj-ubojstva/2317044.aspx,sin-osnivaca-hcspa-dobio-cetiri-godine-zatvora-za-pokusaj-ubojstva,"ŽUPANIJSKI sud u Zagrebu nepravomoćno je na četiri godine zatvora osudio Hrvatina Gabelicu (50), optuženog da je u rujnu 2020. godine u svojem stanu u zagrebačkoj Dalmatinskoj ulici nožem pokušao ubiti Marinka Mikulčića (50).
Sutkinja zagrebačkog Županijskog suda Željka Skomeršić je u pojašnjenju nepravomoćne presude istaknula da sud nije prihvatio Gabeličine tvrdnje da se branio, precizirajući kako je obrana optuženika kontradiktorna njegovoj prvoj obrani, prikupljenim materijalnim dokazima i provedenim vještačenjima.
Dok je ranjeni čekao dolazak hitne, Gabelica je čistio stan od krvi
Sud je pri izricanju presude kao olakotne okolnosti cijenio Gabeličinu smanjenu ubrojivost u trenutku nedjela, neosuđivanost i činjenicu da je nastavnik likovnog odgoja, dok je kao otegotne okolnosti uzeo u obzir osobito teške ozljede koje je nanio Mikulčiću te bešćutnost i bezobzirnost optuženika koji je čistio stan od krvi dok je Mikulčić čekao dolazak hitne pomoći.
Sud je Gabelici, sinu osnivača Hrvatske čiste stranke prava Ivana Gabelice, odredio i obaveznu mjeru liječenja od ovisnosti o drogi te produljio mjeru opreza prema kojoj se ne smije približavati Mikulčiću i njegovoj majci bliže od 100 metara. Uz to, Gabelica mora platiti i troškove suđenja u iznosu od 93.108 kuna.
Gabelica, koji je danas nazočio objavi presude, optužen je da se 19. rujna 2020. oko 21:30 posvađao s Mikulčićem, kojeg je potom ubo nožem u lijevu bočnu stranu donjeg dijela torza. Marinko Mikulčić je tom prilikom zadobio ubodno-reznu ranu trbuha s ozljedom dijela debelog crijeva, a život mu je spašen hitnom liječničkom intervencijom.",vijesti
http://index.hr/vijesti/clanak/sindikat-holdinga-bijesan-zbog-najave-otkaza-za-750-osoba/2317162.aspx,sindikat-holdinga-bijesan-zbog-najave-otkaza-za-750-osoba,"JUČER je održan sastanak uprave Zagrebačkog holdinga s predstavnicima sindikata Zagrebačkog holdinga.
Jutros je sindikat, u tekstu koji potpisuje predsjednik ovog sindikata Dražen Jović, objavio svoje viđenje sastanka.
Ukratko, nisu zadovoljni onim što se od njih traži, a traže se odricanja.
""UPRAVA HOLDINGA U EPIZODI ""KAJ BI NAM ŠTELI DATI?"""", stoji u naslovu objave.
""Jučer je održan sastanak koji je predložila Uprava Holdinga između Pregovaračkih odbora poslodavca i sindikata sa predloženom temom sklapanja Dodatka II kolektivnog ugovora za radnike Zagrebačkog holdinga.
U samome organizacijskom dijelu sastanak je bio promašen, a nakon toga i najavljena tema, a kasnije i sami sastanak"", počinju.
Kažu da je sastanak u startu bio osuđen na propast.
""Na samome sastanku su nedostajala 2 člana Uprave, ali prvenstveno je nedostajao predsjednik Uprave g. Novaković, te je u startu sastanak bio osuđen na propast.
Nestvarno je da se saziva sastanak Pregovaračkih odbora bez da se poštuju osnove zakonskih odredbi, a to je da predstavnici sindikata ne znaju tko su članovi Pregovaračkog odbora poslodavca, jer nikada nam formalno-pravno nije dostavljen taj dokument, kao niti punomoći imenovanih pregovarača da oni doista imaju ovlasti otvoriti pregovore, pregovarati i možda u konačnici nešto potpisati.
Kako bi fijasko bio potpun slijedom nesnalaženja nije se mogao dogovoriti niti Protokol o kolektivnim pregovorima, odnosno o onome o čemu se pregovara o čemu se također treba postići suglasje obje strane"", kažu.
""Čudna dimenzija"" sastanka
Kažu da je sastanak otišao u neku ""čudnu dimenziju""
""Čudno, doista čudni formalno pravni propusti od strane Uprave Holdinga i doista ne možemo ulaziti u razloge fijaska u samoj pripremi sastanka, a sastanka je najavljen kao sastanak Pregovaračkih odbora.
Nakon toga sastanak je otišao opet u neku ""čudnu dimenziju"" razgovora, koju doslovno možemo nazvati kao u naslovu: ""Kaj bi nam šteli dati?"".
Opet smo onako paušalno, bez ikakve ozbiljne analize, bez ikakve platforme dobili pojašnjenje prethodnog pojašnjenja, ""prezentacije koja je održana u četvrtak"" i podatke koji doslovno ne pokazuju ništa"", pišu.
Objavili svoje zahtjeve
""Podsjećamo što mi kao sindikat predlažemo i tražimo:
1) Završetak cjelokupne reorganizacije i sistematizacije u svim trgovačkim društvima u vlasništvu Grada Zagreba, koja jedina temeljem zakonskih odredbi, ali prvenstveno odredbi kolektivnih ugovora može pokazati da li ima i na kojim radnim mjestima manjka ili viška zaposlenih, te ispravak prakse rada ""na istim poslovima, a različitim koeficijentima"" ili ""rad na poslovima na kojima nisu dodijeljeni ispravni ugovori o radu sukladno radnim mjestima na kojima radnici rade""
2) Tražimo da Uprave svih trgovačkih društava sa ""potezom pera"" doslovno reducira sva radna mjesta ""izvan grupa složenosti"", jer Uprave su i postavile pomoćnike, savjetnike, koordinatore, zamjenike, stručne suradnike, naravno poštujući sve zakonske odredbe. To je bilo koja Uprava mogla napraviti ""jučer"" s nekoliko ""poteza pera""
3) Tražimo da se konačno okonča izbor svih voditelja podružnica ili članova Uprave i direktora u trgovačkim društvima, da bi jednostavno dobili odgovorne osobe s kojima možemo krenuti u rješavanje otvorenih pitanja. Otvorena pitanje se ne mogu rješavati sa predstavnicima poslodavca koji su i doveli tvrtke u ovakvo stanje, oni trebaju otići i treba jednostavno postaviti nove ljude sukladno najavama Uprave Holdinga, gradske vlasti i prijedloga sindikata. Ostanak određenog dijela rukovodećeg kadra na funkcijama v.d. voditelja podružnica je loše, ali pravo je odgovornih, jer cijeli sustav stoji, urušava se i gubimo vrijeme svi skupa do novoga javnog natječaja
4) Nemamo odgovora koji je plan zapošljavanja operativnih radnika (nedostaju), prestanak zapošljavanja radnika preko agencija na poslove koji nisu povremeni ili privremeni i Grad Zagreb treba prestati zapošljavati na taj način
5) Što planira Uprava Holdinga sa revitalizacijom, stavljanjem u funkciju ili eventualnom prodajom vrijednog zemljišta i imovine s kojom raspolaže
6) Što se događa i da li se radi na reviziji svih ugovora sa vanjskim tvrtkama/kooperantima/suradnicima/odvjetničkim društvima, te što su pokazale revizije tih ugovora, te kada će se poslovi osigurati za gradska poduzeća naravno sukladno mogućnostima pojedinih gradskih poduzeća
Naravno na ova pitanja koja sam postavio gđa. Subašić Maras nisam dobio nikakav odgovor, koji se može protumačiti ""planom, vizijom, idejom"", jer odgovora jednostavno nema"", stoji u zahtjevima.
Zgroženi najavom otkaza
Šef sindikata Jović potom piše da je zgrožen najavom otkaza za 750 osoba.
""Osobno sam zgrožen jednostavnošću najave kako je 750 radnika viška u Holdingu, jer govorimo o ljudima, djeci i obiteljima, a što je najvažnije ""razbacujemo se brojkama"", jer taj broj se može utvrditi samo završetkom reorganizacije i sistematizacije radnih mjesta.
Paušalno iznositi brojke o broju viškova je potpuno promašeno i ima svrhu zastrašivanja radnika, jer tamo gdje Uprava može rezati ""potezom pera"" na mjestima savjetnika, pomoćnika i sličnim radnim mjestima do voga trenutka nije došao niti jedan jedini prijedlog od strane Uprave da se racionalizira poslovanje ili da se ostvare uštede na takvim radnim mjestima"", piše.
Sindikat: Tražimo da sječa kadrova krene na rukovodećim mjestima
U nastavku dopisa tvrdi se da bi sječa kadrova trebala krenuti među rukovodećim kadrovima
""Stoga molim i javnost i medije u svrhu zaštite radnika da se objektivno izvijesti javnost, jer na rukovodećim mjestima nema 750 radnika. Također sindikati traže da ""sječa kadrova"" krene na rukovodećim mjestima, a ne na radničkim mjestima i naravno da će reprezentativni sindikati znati zaštiti svoje članove u svezi otkaza"", pišu.
""Nakon opetovanih ovlaš donijetih ""projekcija projekcija"" o otkazu za cca 750 radnika, a bez odgovora na prethodno odgovorenih pitanja prezentacija je završila sa rokom da se sve može i treba završiti do 15.12. ove godine, što je moguće samo ako Uprava Holdinga krene u cijelu priču sa novim voditeljima podružnica, sa dobrom namjerom da se isprave nelogičnosti na radnim mjestima, da krene sa smanjivanjem kadrova na rukovodećim mjestima i da prestane sa ""skrivenim pokušajima"" umanjivanja radničkih prava, ali naravno i da ne bude po onoj ""što se babi htilo, to se babi snilo"""", pišu.
Zgroženi zahtjevom da se božićnica daje samo firmama koje posluju u plusu
""Kada pomislite da ne možete iz loše pripremljenog i formalno pravno odrađenog sastanka, te da ne može gore u drugome dijelu sastanka dobijete Prijedlog Dodatka II Kolektivnog ugovora za radnike Zagrebačkog holdinga u kome se traži slijedeće:
1) Odricanje od ""božićnice"" u visini 1.250,00kn i ""nagrade"" u visini 2.500,00kn za ovu 2021 god
2) Da se u budućnosti i do isteka KU ""nagrada"", božićnica"" i ""regres"" vežu pojednostavljeno uz poslovanje poduzeća (pozitivno poslovanje DA, negativno poslovanje NE)
3) Da se izmjeni članak 94 KU
4) Da se briše članak 115 KU""
""Nećete dobiti ni lipu od radnika""
A onda ide zaključak.
""Mislim da je deplasirano uopće tražiti nešto od radnika i već sam nebrojeno puta rekao i napisao slijedeće:
1) Kada mi netko od strane Uprave nekoga trgovačkog društva ili Grada Zagreba argumentirano obrazloži na današnje vrijeme koja je to odgovornost/krivica/propust radnika koji rade u Holdingu većinom za plaće između 4500-5500 kuna ili kakva je odgovornost/propust/krivica radnika ZET-a (jer očito je da će se i na ostala trgovačka društva pokušati ""preliti"" smanjivanje prava i otpuštanja) za neplanska zapošljavanja savjetnika, pomoćnika, cijele ""vojske visoko pozicioniranih radnih mjesta"", koja je odgovornost radnika za promašene investicija, planove, koja je odgovornost radnika za davanje poslova vanjskim firmama, koji su to kredit pod nepovoljnim uvjetima ili obveznice potpisali radnici i slične promašaje ""sposobnih Uprava sa vrhunskim CV papirima"", tada ali samo tada možemo razgovarati o ""odricanju radnika od nekih prava"" u ime i za ime boljeg sutra.
Do tada ponovit ću odgovor na pitanje: ""Kaj bi nam šteli dati?"" odgovor je da nećete dobiti NITI 1 LIPU od radnika"", stoji u zaključku.
",vijesti
http://index.hr/sport/clanak/slavnu-nogometasicu-psga-pretukli-sipkama-napad-narucila-suigracica-i-konkurentica/2317330.aspx,slavnu-nogometasicu-psga-pretukli-sipkama-napad-narucila-suigracica-i-konkurentica,"ZASTRAŠUJUĆA priča iz vrhunskog ženskog nogometa, i to iz kluba koji je jučer pobijedio Real u Ligi prvakinja.
Aminata Diallo, vezna nogometašica PSG-a, uhićena je jer je naručila premlaćivanje šipkama Kheire Hamraoui, koja joj je suigračica u klubu i reprezentaciji Francuske, i to zato što joj je konkurentica za mjesto u momčadima.
Ovo je nogometašica PSG-a uhićena jer je naručila brutalno premlaćivanje suigračice

PSG je potvrdio da je Diallo danas privedena u sklopu istrage otvorene nakon napada na igračicu kluba u četvrtak navečer te dodao: ""Otkako je izvršen napad, klub je poduzeo sve nužne mjere kako bi jamčio zdravlje, dobrobit i sigurnost svim članicama momčadi. PSG usko surađuje s policijom kako bi se rasvijetlili detalji napada. Klub detaljno prati tijek istrage i poduzet će odgovarajuće mjere."" 
Diallo je iz zajedničkog izlaska vozila Hamraoui kući. Odvela ju je do napadača
L'Equipe donosi detalje nevjerojatnog slučaja i napada: ""Nakon zajedničkog izlaska igračica PSG-a, koji je završio večerom u restoranu blizu Bulonjske šume, Hamraoui se kući vraćala autom koji je vozila Diallo. Oko 22 sata automobilu su prišla dvojica maskiranih muškaraca. Jedan je otvorio vrata i sa suvozačkog mjesta izvukao Hamraoui. Zatim su obojica napadača nju udarali željeznim šipkama po nogama prije nego što su pobjegli s mjesta napada."" Hamraoui je prebačena u bolnicu, gdje su joj tretirane rane na nogama i rukama. Naravno, nije igrala u pobjedi PSG-a nad Realom (4:0) u LP-u. 
Žrtva napada je slavna i trofejna nogometašica. Ovo joj je druga gaža u PSG-u, nakon one od 2012. do 2016. Hamraoui je tijekom dvije godine u Lyonu i Barceloni osvojila sva četiri nacionalna prvenstva i tri Lige prvaka. Ljetos se vratila u PSG. Tamo ju je dočekala Diallo, koja je tri mjeseca kasnije organizirala brutalni napad na nju. ",sport
http://index.hr/vijesti/clanak/slovenska-vlada-povecat-ce-place-nekih-radnika-u-zdravstvu-i-socijali/2317314.aspx,slovenska-vlada-povecat-ce-place-nekih-radnika-u-zdravstvu-i-socijali,"SLOVENSKA vlada i sindikati zaposlenih u zdravstvu i socijalnoj skrbi su uskladili i parafirali sporazum o znatnom povećanju plaća u tim djelatnostima za pojedina radna mjesta, a najviše za medicinske sestre na intenzivnim odjelima kojih dramatično nedostaje.
Ministar zdravstva Janez Poklukar, koji je parafirao sporazum u ime vlade, rekao je da bi se njegove odredbe mogle primijeniti već pri isplati plaća u prosincu.
Prema ocjeni sindikata, dogovor koji predviđa povećanje plaća od 4 do 24 posto, ovisno o radnom mjestu, odnosi se na oko 35 tisuća zaposlenih, a državu će stajati dodatnih 40 milijuna eura godišnje.
Najveće povećanje - 24 posto, predviđeno je za plaće medicinskim sestrama na intenzivnim odjelima.
Povišicu od oko 16 posto dobili si zaposleni u socijalnim ustanovama te ostale medicinske sestre, bolničari i tehničari.
Nedostatak radnika
Plaće će se povećati za oko 80 posto zaposlenih u zdravstvenom sektoru te većini u ustanovama socijalne skrbi, predviđa sporazum.
Pregovori o povećanju plaća za srednji i viši medicinski kadar vođeni su od srpnja ove godine, a intenzivirani su četvrtim valom epidemije covida-19 koji je ukazao na kadrovske probleme s kojima se suočavaju bolnice, osobito u zbrinjavanju covid-pacijenata na intenzivnim odjelima.
Na Sveučilišnom kliničkom centru (UKC) u Ljubljani, prema nekim izjavama odgovornih, zbog nedovoljnih plaća i fluktuacije kadra u inozemstvo trenutno nedostaje 30 posto potrebnih medicinskih sestara, osobito onih osposobljenih za rad na intenzivnim odjelima,
Kako je ovih dana izjavio Franc Vindišar, državni tajnik u ministarstvu zdravstva, standard za intenzivne odjele prije epidemije covida-19 bio je da se 4 medicinske sestre skrbe za jednog pacijenta dnevno.
Sada je taj standard spušten na manje od dvije sestre, što svjedoči o dramatičnosti situacije i nedostatku osposobljenog medicinskog kadra u kriznoj situaciji s naglim povećanjem hospitalizacija.",vijesti
http://index.hr/sport/clanak/sostaric-objavio-popis-rukometasica-za-sp-hrvatska-tamo-prvi-put-nakon-10-godina/2317091.aspx,sostaric-objavio-popis-rukometasica-za-sp-hrvatska-tamo-prvi-put-nakon-10-godina,"ZA tri tjedna u Španjolskoj počinje SP za rukometašice (od 1. do 19. prosinca), a zahvaljujući bronci sa zadnjeg Eura, nakon deset godina tamo će biti i Hrvatska.
Izbornik Nenad Šoštarić imat će manje od deset dana za pripreme koje počinju 22. studenog, a reprezentacije će do polaska za Španjolsku 30. studenog trenirati u Poreču.
Za to vrijeme će odigrati dvije prijateljske utakmice sa Slovenijom, 25. studenog zatvorenog tipa te dva dana kasnije uz prijenos na RTL televiziji. 
Na popisu su sve ključne igračice brončane ekipe, a Šoštarić je pozvao i iskusnu Anu Turk na poziciji desnog krila, što je svakako malo iznenađenje. Poziv je dobila i povratnica nakon ozljede Josipa Mamić, zatim je tu i mlada Laura Burić, kao i Tena Japundžija. Četiri igračice za samo dva mjesta. 
Hrvatska skupina G igra se u Castellonu, a igračice Nenada Šoštarića otvaraju turnir s Brazilom (2. prosinca) pa slijede Paragvaj (4.) i Japan (6.). Tri reprezentacije prolaze u drugi krug, ali plan je prenijeti sva četiri boda jer s njima bi četvrtfinale, u konkurenciji Španjolske, Austrije, Kine i Argentine, s kojima se Hrvatska križa, bilo dohvatljivo.
Popis za pripreme:
PIJEVIĆ, ALBA FEHERVAR KC
IVANA KAPITANOVIĆ, METZ HANDBALL
LUCIJA BEŠEN, RK LOKOMOTIVA ZAGREB
PAULA POSAVEC, RK KRIM MERCATOR
ANDREA ŠIMARA, RK LOKOMOTIVA ZAGREB
ANA TURK, RK PODRAVKA VEGETA
JOSIPA MAMIĆ, RK LOKOMOTIVA ZAGREB
LARA BURIĆ, RK LOKOMOTIVA ZAGREB
KATARINA JEŽIĆ, HC SIÓFOK KC
ANA DEBELIĆ, VIPERS KRISTIANSAND
ĆAMILA MIČIJEVIĆ, METZ HANDBALL
LARISSA KALAUS, RK PODRAVKA VEGETA
VALENTINA BLAŽEVIĆ, CS MAGURA CISNADIE
DEJANA MILOSAVLJEVIĆ, RK PODRAVKA VEGETA
STELA POSAVEC, RK LOKOMOTIVA ZAGREB
DORA KRSNIK, PLAN DE CUQUES HB
DORA KALAUS, RK LOKOMOTIVA ZAGREB
IVANA DEŽIĆ, ŽRK KOKA VARAŽDIN
TENA JAPUNDŽA, RK LOKOMOTIVA ZAGREB
PRIČUVNE IGRAČICE (Dolaze u slučaju naknadnog poziva)
GABRIJELA BEŠEN BARTULOVIĆ, DUNAUJVAROSI KOHASZ KA
KORINA KARLOVČAN, RK PODRAVKA VEGETA
GABRIELA GUDELJ, ŽRK ZRINSKI
INES LISJAK, RK LOKOMOTIVA ZAGREB
KATARINA PAVLOVIĆ, HC ROCASA GRAN CANARIA
KRISTINA PRKAČIN, SZOMBATHELYI KKA",sport
http://index.hr/sport/clanak/sport-real-stvara-nove-galacticose-oko-halanda-i-mbappea-ovo-je-plan/2317123.aspx,sport-real-stvara-nove-galacticose-oko-halanda-i-mbappea-ovo-je-plan,"REAL MADRID uskoro ulazi u eru novih Galacticosa, piše španjolski Sport. Predsjednik Florentino Perez će tu momčad graditi na dvije najveće mlade nogometne zvijezde, Kylianu Mbappéu i Erlingu Halandu.
Kako bi Real došao do potrebnih sredstava za dva mega transfera, potrebno je riješiti se čak petorice igrača. Isco, Marcelo i Gareth Bale već dugo vremena ne igraju ozbiljnu ulogu, a imaju astronomsku plaću. Srećom po Madriđane, ugovor im istječe na ljeto i navodno im klub neće ponuditi novi. Njihovim odlaskom trebao bi se jako otvoriti budžet za nove plaće.
Uz to, Real će se pokušati riješiti dvojice igrača koji su ispali veliki promašaj. Prvi je srpski napadač Luka Jović kojeg je Real doveo za 60 milijuna eura, a sada se nada izvući barem upola toliko. Drugi je Eden Hazard. Belgijskog napadača Real je platio čak 115 milijuna eura, a sad ga je spreman prodati za 50 milijuna eura.
Sve ovo moglo bi donijeti Realu oko 130 milijuna eura, što bi bio ogroman kapital u lovu na francuskog i norveškog napadača. Florentino Perez, piše Sport, čini sve da obojicu dovede u klub već na ljeto.
",sport
